produto;preco_com_desconto;preco_sem_desconto
24-168 Colored Marker Pens Set Manga Brush Pen Drawing sketch Kawaii Art School Supplies Stationery Paint Lettering Markers;50.17;93.84
For Magesafe Magnetic Transparent Wireless Charge Case For iPhone 11 12 13 14 15 16 Pro Max Plus Mini X 7 8 Shockproof PC Cover;8.64;30.44
Xiaomi T7500 Bluetooth Earphones Wireless Bone Conduction HiFi Stereo Sports Waterproof Earphone With Microphone For Game Music;24.19;24.69
FADVAN YY Shape 6-15mm Lashes 2D 0.07/0.05mm Faux Mink C/D Curl Natural Soft Brazilian Premade Volume Fan Eyelashes Extension;10.39;30.07
Vintage Hair Trimmer Cordless Electric Hair Cutting Machine Portable Shaver Barber USB Fast Charging Hair Clipper For Hairdresse;11.19;46.86
1Pc New Ultra-thin Mini Soft PU Leather Credit Card Wallet Holder Short Vertical High Quality Men's Wallet;11.69;27.15
12/24/30/40/60/80/100/120/168pcs Art Marker Set, Watercolor Brush Pens For Students, Dual Tip Oil-Based Markers For Art Students;23.99;50.0
For Magesafe Magnetic Transparent Wireless Charge Case For iPhone 11 12 13 14 15 16 Pro Max Plus Mini X 7 8 Shockproof PC Cover;8.89;18.52
Wireless Bluetooth Earphone With White TWS Sports Microphone;149.5;150.0
Summer Sun Hats UV Protection Outdoor Hunting Fishing Cap For Men Women Hiking Camping Visor Bucket Hat Neck Flap Fisherman Hat;11.69;30.2
Smartwatch Men Women Wristwatches Smart Watch Message Fitness Monitor Bracelet Birthday Gift Electronic Clock For Xiaomi Huawei;13.59;60.9
9cm Naruto Anime Figure Uzumaki Naruto Kakashi Uchiha Sasuke Itachi Cute Toys Q Figurals Action Figurine Model;11.77;36.1
24-80 Colors Double Headed Oily Art Marker Pen Set for Draw Sketching Oily Tip Based Markers Graffiti Manga School Art Supplies;45.97;89.37
Night Vision Glasses PC Frame Polarized Sunglasses Men Outdoor Sport Sun Glasses Day Night Vision Driver Night Glasses Goggles;11.25;11.75
KZ EDX Pro Earphones Dynamic In Ear Monitor HiFi Wired Headphones Bass Stereo Game Music Earplugs Noice Cancelling Headset;28.59;32.74
Hot Disney Cartoon Blue Pink Stitch Plush Dolls Anime Toys Lilo and Stitch Stich Plush Stuffed Toys Christmas Gifts for Kids;26.09;114.54
Hot sales Coconut Slippers Cloud Thick-soled Sandals Summer Fashion Soft Bottom Beach Men Slippers Women's Sandals EVA Slides;21.14;47.04
Book Light LED Moon Light Galaxy Light, Moon Night Light, Girl, Boy, Child Birthday Gift, Bedroom Decoration Indoor lighting;10.39;43.58
RGB Led Strip Lights 5m 10m 20m 30m Led Room Light with APP Control Flexible Ribbon Luces Led Tape for Room Bedroom Decoration;12.01;13.29
New 3D Printed Kanye Mask Elastic Mesh Full Face Mask for Men Women Cosplay Headwear Hip Hop Fashion Balaclava Hood Hat Headgear;11.39;33.04
6 Pcs/Lot NARUTO Sasuke Gaara Uchiha Madara Figure 7-8cm 2 Style Personality Base Mini Figurines;21.99;67.29
Fashion Square Vintage Polarized Sunglasses Men Women Retro Driving Fishing Sun Glasses UV400 Eyewear;25.17;25.67
Summer Fashion Men's Slippers Printting Little Bear Sandals Indoor Bathroom Non-slip Soft Women Dormitory Casual Shoes Couple;12.79;45.26
1PC Large Mouse Pads For Desk, Gaming Mouse Pad, Mouse Pad with Stitched Edges and Non-Slip Rubber Base, Extended Mouse Pad;11.06;23.12
LED Strip Lights RGB 3535 ,5V 1M-30M,16 million colors, RGB , Led Strip Lighting Music Sync, Color Changing for Party Home;13.49;52.98
10Pcs/set High Quality Needle Type Gel Pens Straight Liquid Ballpoint Pen Kawaii Stationery School Office Supplies Writing;13.49;41.12
Hot Anime Dragon Ball Son Goku Super Saiyan Figure 17cm/6.69in Goku DBZ Action Figure Model Gifts Collectible Figurines for Kids;16.19;10.79
1-4Pcs Anti Spy Tempered Glass For iPhone 16 14 13 11 15Pro Max Mini 7 8 Plus Privacy Screen Protector for iPhone 15 X XR XS MAX;9.71;36.51
EVA House Shoes Non-Slip thick Soft Platform Slide Sandals for Women Men Indoor Outdoor Shower Bathroom Slipper for Adult;13.49;70.08
Hot selling anime doll second-generation LABUBU blind box party series vinyl doll keychain pendant toy girlfriend birthday gifts;34.54;34.54
